{
  "format": "wiretruth.shim/v1",
  "name": "reference",
  "language": "python",
  "packages": {"wiretruth": "0.1.0.dev0"},
  "primary_package": "wiretruth",
  "entry": ["python", "shim.py"],
  "providers": {"openai-chat": "raw HTTP via wiretruth.providers.openai_chat"},
  "surfaces": {},
  "finish_map": {},
  "error_map": [],
  "unsupported": [],
  "config_notes": [],
  "docs": []
}
